category,sub_category,city,name,area,address,phone_no_1,phone_no_2,source,ratings,state,country,email,latitude,longitude,reviews,facebook_url,linkedin_url,twitter_url,description,pincode,virtual_phone_no,whatsapp_no,phone_no_3,avg_spent,cost_for_two
Education,College,Brahma Samudram,Brahmasamudram Government School,"GXQ2+PG6, Brahmasamudram","GXQ2+PG6, Brahmasamudram, Andhra Pradesh 515767",,,,,Andhra Pradesh,India,,,,,,,,,515767,,,,,
Education,College,Brahma Samudram,KGBV BRAHMASAMUDRAM,"GWPX+R37, Brahmasamudram","GWPX+R37, Brahmasamudram, Andhra Pradesh 515767",,,,,Andhra Pradesh,India,,,,3,,,,,515767,,,,,
Education,College,Brahma Samudram,Residential school for girls,"GXQ2+RP7 Recidential school for girls, Brahmasamudram","GXQ2+RP7 Recidential school for girls, Brahmasamudram, Andhra Pradesh 515767",,,,,Andhra Pradesh,India,,,,2.3,,,,,515767,,,,,
Education,College,Brahma Samudram,BRAHMASAMUDRAM CHURCH,"GOVT SCHOOL, VILLAGE NEAR","GOVT SCHOOL, VILLAGE NEAR, Brahmasamudram, Andhra Pradesh",,,,,Andhra Pradesh,India,,,,,,,,,515767,,,,,
Education,College,Brahma Samudram,Johns home,"GWQX+C3C, Brahmasamudram","GWQX+C3C, Brahmasamudram, Andhra Pradesh 515767",,,,,Andhra Pradesh,India,,,,,,,,,515767,,,,,
Education,College,Brahma Samudram,Sri Sai Baba National Degree College,"MHFX+PF3, Hospital Road","MHFX+PF3, Hospital Road, opp. ZP Office, Gulzarpet, Anantapur, Andhra Pradesh 515001",085542 44585,,ssbnc.in,,Andhra Pradesh,India,,,,4.2,,,,,515001,,,,,
Education,College,Brahma Samudram,mpp School,"MHFX+PF3, Hospital Road","MHFX+PF3, Hospital Road, opp. ZP Office, Gulzarpet, Anantapur, Andhra Pradesh 515001",085542 44585,,ssbnc.in,,Andhra Pradesh,India,,,,4.2,,,,,515001,,,,,
Education,College,Brahma Samudram,bramhasamudram sachivalayam,"GWQW+GVM, Brahmasamudram","GWQW+GVM, Brahmasamudram, Andhra Pradesh 515767",,,,,Andhra Pradesh,India,,,,3.7,,,,,515767,,,,,
Education,College,Brahma Samudram,M.p.p. school,"GXM7+CC8, Anantapuram Nanjapuram","GXM7+CC8, Anantapuram Nanjapuram, Brahmasamudram, Andhra Pradesh 515767",,,,,Andhra Pradesh,India,,,,5,,,,,515767,,,,,
Education,College,Brahma Samudram,Srisaila Bramarambika Junior college,"Hanuman circle, opp. Vishal Mart","Hanuman circle, opp. Vishal Mart, Donimukkala, Guntakal, Andhra Pradesh 515801",085522 22424,,srisailabramarambikajuniorcollege.org,,Andhra Pradesh,India,,,,3.9,,,,,515801,,,,,
Education,College,Brahma Samudram,Bramhsamudram Anganwadi center 1,"GWQW+GVP, Unnamed Road","GWQW+GVP, Unnamed Road, Brahmasamudram, Andhra Pradesh 515767",,,,,Andhra Pradesh,India,,,,,,,,,515767,,,,,
Education,College,Chandragiri,Govt junior college for boys,"3-157, Srinivasa Mangapuram Rd","3-157, Srinivasa Mangapuram Rd, Chandragiri, Andhra Pradesh 517101",,,,,Andhra Pradesh,India,,,,3.9,,,,,517101,,,,,
Education,College,Chandragiri,"Government Polytechnic College, Chandragiri","Ithepalli, Andhra Pradesh 517102","Ithepalli, Andhra Pradesh 517102",090102 22166,,govtpolychandragiri.ac.in,,Andhra Pradesh,India,,,,4.3,,,,,517102,,,,,
Education,College,Chandragiri,Sampradaya Paatashaala,"H8QJ+R4M, Chandragiri","H8QJ+R4M, Chandragiri, Andhra Pradesh 517101",,,,,Andhra Pradesh,India,,,,4.5,,,,,517101,,,,,
Education,College,Chandragiri,MGR College of Physiotherapy,"Old pet, Chandragiri","Old pet, Chandragiri, Tirupati, Andhra Pradesh 517101",092914 55118,,mgrmedicalsciences.org,,Andhra Pradesh,India,,,,5,,,,,517101,,,,,
Education,College,Chandragiri,GOVERNMENT BC COLLEGE BOYS HOSTEL,"H8R6+XHG, Chandragiri","H8R6+XHG, Chandragiri, Andhra Pradesh 517101",,,,,Andhra Pradesh,India,,,,3.8,,,,,517101,,,,,
Education,College,Chandragiri,SGS Arts College,"19-4-3H/ 13 A2 Venkatareddy colony, STV Nagar","19-4-3H/ 13 A2 Venkatareddy colony, STV Nagar, Tirupati, Andhra Pradesh 517501",,,sgsac.edu.in,,Andhra Pradesh,India,,,,4.4,,,,,517501,,,,,
Education,College,Chandragiri,Royal MBA College,"H7GW+V73, Andhra Pradesh 517101","H7GW+V73, Andhra Pradesh 517101",,,,,Andhra Pradesh,India,,,,4.1,,,,,517101,,,,,
Education,College,Chandragiri,Sri Padmavathi Zilla Parishad Girls High School,"H8Q9+754, Chandragiri","H8Q9+754, Chandragiri, Andhra Pradesh 517101",,,,,Andhra Pradesh,India,,,,,,,,,517101,,,,,
Education,College,Chandragiri,GOVT JUNIOR COLLEGE (GIRLS),"Unnamed Road, Chandragiri","Unnamed Road, Chandragiri, Andhra Pradesh 517101",,,,,Andhra Pradesh,India,,,,4.4,,,,,517101,,,,,
Education,College,Chandragiri,Sree Srinivasa Degree College,"H8R6+FXH, Dwaraka Nagar Road","H8R6+FXH, Dwaraka Nagar Road, Chandragiri, Andhra Pradesh 517101",,,,,Andhra Pradesh,India,,,,3.3,,,,,517101,,,,,
Education,College,Chandragiri,s p ram rayalaseema jr college,"H8Q8+66V, Chandragiri","H8Q8+66V, Chandragiri, Andhra Pradesh 517101",,,,,Andhra Pradesh,India,,,,,,,,,517101,,,,,
Education,College,Chandragiri,Divya,"H8Q8+66V, Chandragiri","H8Q8+66V, Chandragiri, Andhra Pradesh 517101",,,,,Andhra Pradesh,India,,,,,,,,,517101,,,,,
Education,College,Chandragiri,Nri,"H8Q8+66V, Chandragiri","H8Q8+66V, Chandragiri, Andhra Pradesh 517101",,,,,Andhra Pradesh,India,,,,,,,,,517101,,,,,
Education,College,Chirala,VRS & YRN College Chirala,"R9MJ+RFP, Chirala Bypass Rd","R9MJ+RFP, Chirala Bypass Rd, NTR Nagar, Chirala, Ipuru Palem Rural, Andhra Pradesh 523157",085942 39523,,vrsyrn.com,,Andhra Pradesh,India,,,,4,,,,,523157,,,,,
Education,College,Chirala,Chirala Engineering College Chirala,"R9MJ+RFP, Chirala Bypass Rd","R9MJ+RFP, Chirala Bypass Rd, NTR Nagar, Chirala, Ipuru Palem Rural, Andhra Pradesh 523157",085942 39523,,vrsyrn.com,,Andhra Pradesh,India,,,,4,,,,,523157,,,,,
Education,College,Chirala,"Sri Vidya Junior College, Chirala","Durbar Rd, Paparajuthota","Durbar Rd, Paparajuthota, Chirala, Andhra Pradesh 523155",085942 32024,,,,Andhra Pradesh,India,,,,4,,,,,523155,,,,,
Education,College,Chirala,Bharathi Degree College,"Station Road, Perala","Station Road, Perala, Chirala, Andhra Pradesh 523157",099125 20533,,,,Andhra Pradesh,India,,,,4.2,,,,,523157,,,,,
Education,College,Chirala,St. Ann's College of Engineering & Technology,"Q8GH+GGH, Nayani Palli Village","Q8GH+GGH, Nayani Palli Village, ChallaReddy Palem Post, Vetapalem Mandal, Chirala, Andhra Pradesh 523187",085942 47500,,sacet.ac.in,,Andhra Pradesh,India,,,,3.8,,,,,523187,,,,,
Education,College,Chirala,Yarlagadla Annapoornamba (YA) Government College for Women,"R9H2+CCC, High School Rd","R9H2+CCC, High School Rd, Muntha vari Centre, Chirala, Andhra Pradesh 523155",085942 32204,,yagcwchirala.ac.in,,Andhra Pradesh,India,,,,3.9,,,,,523155,,,,,
Education,College,Chirala,SriMedha V,"Muntha vari Centre, Chirala","Muntha vari Centre, Chirala, Andhra Pradesh 523156",,,srimedhav.com,,Andhra Pradesh,India,,,,3.8,,,,,523156,,,,,
Education,College,Chirala,Sri Gowthami Institutions,"R9F6+8H2, Government Hospital Rd","R9F6+8H2, Government Hospital Rd, Wood Nagar Colony, Chirala, Andhra Pradesh 523157",,,,,Andhra Pradesh,India,,,,4,,,,,523157,,,,,
Education,College,Chirala,Chaitanya Bharathi Degree College,"R9H3+C5Q, Muntha vari Centre","R9H3+C5Q, Muntha vari Centre, Chirala, Andhra Pradesh 523156",,,,,Andhra Pradesh,India,,,,4,,,,,523156,,,,,
Education,College,Chirala,Vignana Bharathi Junior College,"R9G4+4P7, Wood Nagar Colony","R9G4+4P7, Wood Nagar Colony, Chirala, Andhra Pradesh 523157",,,,,Andhra Pradesh,India,,,,3.7,,,,,523157,,,,,
Education,College,Chirala,"CHIRALA COLLEGE OF NURSING (GNM, PBBSc-Post Basic BSc and BSc Nursing College in Chirala, Bapatla District)","R9G4+4P7, Wood Nagar Colony","R9G4+4P7, Wood Nagar Colony, Chirala, Andhra Pradesh 523157",,,,,Andhra Pradesh,India,,,,3.7,,,,,523157,,,,,
Education,College,Chirala,St.Ann's College of Pharmacy,"Q8HJ+39J, Nayunipalli(V)","Q8HJ+39J, Nayunipalli(V), Vetapalem(Md, Chirala Bypass Rd, Chirala, Andhra Pradesh 523187",098485 10999,,sacet.ac.in,,Andhra Pradesh,India,,,,3.9,,,,,523187,,,,,
Education,College,Chirala,Chirala College Of PG Studies,"Q9P9+VVQ, Kotha Peta Rural","Q9P9+VVQ, Kotha Peta Rural, Andhra Pradesh 523165",,,,,Andhra Pradesh,India,,,,4.5,,,,,523165,,,,,
Education,College,Chirala,pratap college education,"R957+F2X, Ramapuram Beach Rd","R957+F2X, Ramapuram Beach Rd, Indira Nagar Colony, Kothapeta, Chirala, Andhra Pradesh 523157",092950 45672,,,,Andhra Pradesh,India,,,,4.5,,,,,523157,,,,,
Education,College,Chirala,AKP & PK Junior College,"R9JF+3GJ, Vadarevu Rd NTR Nagar","R9JF+3GJ, Vadarevu Rd NTR Nagar, Kothapeta, Chirala, Andhra Pradesh 523157",,,,,Andhra Pradesh,India,,,,4.2,,,,,523157,,,,,
Education,College,Chirala,ITI College,"Q8W8+3VW, ITI Colony","Q8W8+3VW, ITI Colony, Jandrapeta, Chirala, Andhra Pradesh 523187",,,,,Andhra Pradesh,India,,,,4.4,,,,,523187,,,,,
Education,College,Chirala,SKBNM ITI COLLEGE IPURUPALEM,"Q8W8+3VW, ITI Colony","Q8W8+3VW, ITI Colony, Jandrapeta, Chirala, Andhra Pradesh 523187",,,,,Andhra Pradesh,India,,,,4.4,,,,,523187,,,,,
Education,College,Chirala,Oxford school of nursing,"Kothapeta, Chirala","Kothapeta, Chirala, Andhra Pradesh 523157",090000 16363,,,,Andhra Pradesh,India,,,,,,,,,523157,,,,,
Education,College,Chirala,Sri Narendra ITC,"Marimmapeta, Chirala","Marimmapeta, Chirala, Andhra Pradesh 523155",086392 85882,,,,Andhra Pradesh,India,,,,4.9,,,,,523155,,,,,
Education,College,Chirala,St Marks Luthern Junior College,"R9H5+8P2, Perala","R9H5+8P2, Perala, Chirala, Andhra Pradesh 523157",,,,,Andhra Pradesh,India,,,,4.9,,,,,523157,,,,,
Education,College,Chirala,Chirala Engineering College Cricket Ground,"Q9QF+R88, Kotha Peta Rural","Q9QF+R88, Kotha Peta Rural, Andhra Pradesh 523165",,,cecc.co.in,,Andhra Pradesh,India,,,,5,,,,,523165,,,,,
Education,College,Chirala,Viveka College Of Education,"M), Papayapalem","M), Papayapalem, D.no. 6-137, Vaddesangam, Kottapeta Vetapalem, PO, Chirala, Andhra Pradesh 523157",085942 02004,,,,Andhra Pradesh,India,,,,3.9,,,,,523157,,,,,
Education,College,Chirala,Chirala engineering college hostel,"Q9QC+8P8, Chirala Engineering College Rd","Q9QC+8P8, Chirala Engineering College Rd, Kotha Peta Rural, Andhra Pradesh 523165",,,,,Andhra Pradesh,India,,,,,,,,,523165,,,,,
Education,College,Chirala,B.B.H Jr College Vetapalem,"Q8M3+F2R, Panchayati Rd","Q8M3+F2R, Panchayati Rd, Vetapalem, Andhra Pradesh 523187",,,,,Andhra Pradesh,India,,,,4.2,,,,,523187,,,,,
Education,College,Chirala,Bandla Bapaiah Hindu Junior College Ground,"Q8M3+JCM, Vetapalem","Q8M3+JCM, Vetapalem, Andhra Pradesh 523187",,,,,Andhra Pradesh,India,,,,4.7,,,,,523187,,,,,
Education,College,Chirala,SRI CHUNDURI SATYANARAYANA SON ( 326 ) - CHIRALA,"shop : 326, mgc market","shop : 326, mgc market, Muntha vari Centre, Chirala, Andhra Pradesh 523155",088858 82764,,,,Andhra Pradesh,India,,,,4.6,,,,,523155,,,,,
Education,College,Chirala,Kalikamba College of Education,"R9F7+776, Kothapeta","R9F7+776, Kothapeta, Chirala, Andhra Pradesh 523157",085942 36233,,kalikambabed.org,,Andhra Pradesh,India,,,,4.3,,,,,523157,,,,,
Education,College,Chirala,PSB College of Education,"R9F6+9GC, Polimera Rd","R9F6+9GC, Polimera Rd, Wood Nagar Colony, Chirala, Andhra Pradesh 523157",085942 35042,,,,Andhra Pradesh,India,,,,4.3,,,,,523157,,,,,
Education,College,Chirala,Chirala Prakasam Dist Andhra pradesh,"R9G2+7XG, Vidya College Road","R9G2+7XG, Vidya College Road, Muntha vari Centre, Chirala, Andhra Pradesh 523156",,,,,Andhra Pradesh,India,,,,5,,,,,523156,,,,,
Education,College,Chirala,Narayana Junior College,"Paparajuthota, Chirala","Paparajuthota, Chirala, Andhra Pradesh 523157",085942 39667,,,,Andhra Pradesh,India,,,,3.4,,,,,523157,,,,,
Education,College,Chirala,B.B.H DEGREE COLLEGE,"Q8CC+X5Q, near National Highway 216","Q8CC+X5Q, near National Highway 216, Vetapalem, Nayani Palli Rural, Andhra Pradesh 523187",,,,,Andhra Pradesh,India,,,,4.4,,,,,523187,,,,,
Education,College,Chirala,Ashwak,"R9XQ+HWF, Ipurupalem","R9XQ+HWF, Ipurupalem, Ipuru Palem Rural, Andhra Pradesh 523166",,,,,Andhra Pradesh,India,,,,5,,,,,523166,,,,,
Education,College,Chirala,Chirala,"H. No 16-6.13-1, near Saibaba Temple Street","H. No 16-6.13-1, near Saibaba Temple Street, paparaju thota, Ipurupalem, Chirala, Ipuru Palem Rural, Andhra Pradesh 523166",,,,,Andhra Pradesh,India,,,,,,,,,523166,,,,,
Education,College,Chirala,Krupa Kiran Nandamudi,"13-121, Jandrapeta","13-121, Jandrapeta, Chirala, Andhra Pradesh 523165",,,teeminternational.org,,Andhra Pradesh,India,,,,,,,,,523165,,,,,
Education,College,Gajuwaka,SR JUNIOR COLLEGE gajuwaka vizag,"1-88, Mehar Nagar","1-88, Mehar Nagar, Chaitanya Nagar, Gajuwaka, Visakhapatnam, Andhra Pradesh 530026",,,,,Andhra Pradesh,India,,,,4.4,,,,,530026,,,,,
Education,College,Gajuwaka,TSR & TBK Degree College,"Mango Grove, 27-1-235/1 Gajuwaka (PO Srinagar","Mango Grove, 27-1-235/1 Gajuwaka (PO Srinagar, Sri Nagar, Gajuwaka, Visakhapatnam, Andhra Pradesh 530026",089125 15657,,tsrtbkcollege.com,,Andhra Pradesh,India,,,,3.7,,,,,530026,,,,,
Education,College,Gajuwaka,M.V.R Degree College,"Mango Grove, 27-1-235/1 Gajuwaka (PO Srinagar","Mango Grove, 27-1-235/1 Gajuwaka (PO Srinagar, Sri Nagar, Gajuwaka, Visakhapatnam, Andhra Pradesh 530026",089125 15657,,tsrtbkcollege.com,,Andhra Pradesh,India,,,,3.7,,,,,530026,,,,,
Education,College,Gajuwaka,Andalamma College,"M6PF+V8X, Gajuwaka","M6PF+V8X, Gajuwaka, Visakhapatnam, Andhra Pradesh 530011",,,,,Andhra Pradesh,India,,,,3.7,,,,,530011,,,,,
Education,College,Gajuwaka,Sri Chaitanya Junior College,"M6PF+V8X, Gajuwaka","M6PF+V8X, Gajuwaka, Visakhapatnam, Andhra Pradesh 530011",,,,,Andhra Pradesh,India,,,,3.7,,,,,530011,,,,,
Education,College,Gajuwaka,Aditya Degree College,"Exibition Road, Chaitanya Nagar","Exibition Road, Chaitanya Nagar, Gajuwaka, Visakhapatnam, Andhra Pradesh 530044",085019 86662,,aditya.ac.in,,Andhra Pradesh,India,,,,3.6,,,,,530044,,,,,
Education,College,Gajuwaka,Sri Gayatri Junior College,"Exibition Road, Chaitanya Nagar","Exibition Road, Chaitanya Nagar, Gajuwaka, Visakhapatnam, Andhra Pradesh 530044",085019 86662,,aditya.ac.in,,Andhra Pradesh,India,,,,3.6,,,,,530044,,,,,
Education,College,Gajuwaka,Sri Surya Junior College,"241/E4-4/12 38 Bus Stop Road, Old Gajuwaka","241/E4-4/12 38 Bus Stop Road, Old Gajuwaka, Chaitanya Nagar, Visakhapatnam, Andhra Pradesh 530026",090300 27327,,,,Andhra Pradesh,India,,,,4.5,,,,,530026,,,,,
Education,College,Gajuwaka,AVK JUNIOR & DEGREE COLLEGES,"241/E4-4/12 38 Bus Stop Road, Old Gajuwaka","241/E4-4/12 38 Bus Stop Road, Old Gajuwaka, Chaitanya Nagar, Visakhapatnam, Andhra Pradesh 530026",090300 27327,,,,Andhra Pradesh,India,,,,4.5,,,,,530026,,,,,
Education,College,Gajuwaka,Ramabhanam iit jee nee,"M5JW+R2W, Chaitanya Nagar","M5JW+R2W, Chaitanya Nagar, Gajuwaka, Visakhapatnam, Andhra Pradesh 530044",,,,,Andhra Pradesh,India,,,,4.9,,,,,530044,,,,,
Education,College,Gajuwaka,tsr Tbk College,"M5MQ+8QJ, 60 Feet Rd","M5MQ+8QJ, 60 Feet Rd, Chaitanya Nagar, Gajuwaka, Visakhapatnam, Andhra Pradesh 530044",089125 15657,,,,Andhra Pradesh,India,,,,3.9,,,,,530044,,,,,
Education,College,Gajuwaka,Vignan's Institute Of Information Technology,"Besides VSEZ Vadlapudi Duvvada, Gajuwaka","Besides VSEZ Vadlapudi Duvvada, Gajuwaka, Visakhapatnam, Andhra Pradesh 530049",,,vignaniit.edu.in,,Andhra Pradesh,India,,,,3.7,,,,,530049,,,,,
Education,College,Gajuwaka,ADITYA DEGREE COLLEGE WOMENS GAJUWAKA,"Besides VSEZ Vadlapudi Duvvada, Gajuwaka","Besides VSEZ Vadlapudi Duvvada, Gajuwaka, Visakhapatnam, Andhra Pradesh 530049",,,vignaniit.edu.in,,Andhra Pradesh,India,,,,3.7,,,,,530049,,,,,
Education,College,Gajuwaka,Sree Gayathri Open & Distance Education College,"530026, 13-9-1/1","530026, 13-9-1/1, Balacheruvu Rd, New Gajuwaka, Gajuwaka, Visakhapatnam, Andhra Pradesh 530026",094941 63117,,,,Andhra Pradesh,India,,,,4.4,,,,,530026,,,,,
Education,College,Gajuwaka,Vidyavikas junuor college,"530026, 13-9-1/1","530026, 13-9-1/1, Balacheruvu Rd, New Gajuwaka, Gajuwaka, Visakhapatnam, Andhra Pradesh 530026",094941 63117,,,,Andhra Pradesh,India,,,,4.4,,,,,530026,,,,,
Education,College,Gajuwaka,NRI Jr College,"D No. 10-1-78/3, Mehar Nagar","D No. 10-1-78/3, Mehar Nagar, Chaitanya Nagar, Gajuwaka, Visakhapatnam, Andhra Pradesh 530044",081210 33775,,,,Andhra Pradesh,India,,,,3.1,,,,,530044,,,,,
Education,College,Gajuwaka,NRI Academy,"241/E4-4/13, 8-13-14/4","241/E4-4/13, 8-13-14/4, 38 Bus Stop Road, National Highway - 5, Near Amaravathi Hotel, Opposite 38 Bus Stop, Old Gajuwaka, Chaitanya Nagar, Gajuwaka, Visakhapatnam, Andhra Pradesh 530026",,,nrieducationalsociety.com,,Andhra Pradesh,India,,,,3.1,,,,,530026,,,,,
Education,College,Gajuwaka,Narayana Junior College,"Narayana Junior College, Old Gajuwaka","Narayana Junior College, Old Gajuwaka, Chaitanya Nagar, Gajuwaka, Visakhapatnam, Andhra Pradesh 530026",089125 13311,,,,Andhra Pradesh,India,,,,3.4,,,,,530026,,,,,
Education,College,Gajuwaka,Krishna Degree College,"M5JW+R2W, Chaitanya Nagar","M5JW+R2W, Chaitanya Nagar, Gajuwaka, Visakhapatnam, Andhra Pradesh 530044",099632 67239,,drvskrishnagdc.edu.in,,Andhra Pradesh,India,,,,3,,,,,530044,,,,,
Education,College,Gajuwaka,MANASA JUNIOR COLLEGE(Visakhapatnam) IIT-JEE,"Depot, 68-1-83/2","Depot, 68-1-83/2, New Gajuwaka, Mulagada, Mindi, Visakhapatnam, Andhra Pradesh 530012",,,manasadefenceacademy.in,,Andhra Pradesh,India,,,,4.6,,,,,530012,,,,,
Education,College,Gajuwaka,MASTER MINDS,"Depot, 68-1-83/2","Depot, 68-1-83/2, New Gajuwaka, Mulagada, Mindi, Visakhapatnam, Andhra Pradesh 530012",,,manasadefenceacademy.in,,Andhra Pradesh,India,,,,4.6,,,,,530012,,,,,
Education,College,Gajuwaka,sree krishna junior college,"Mango Grove, 27-1-235","Mango Grove, 27-1-235, Sri Nagar Main Rd, Sri Nagar, Gajuwaka, Visakhapatnam, Andhra Pradesh 530026",099853 02755,,sreekrishnajuniorcollege.com,,Andhra Pradesh,India,,,,3,,,,,530026,,,,,
Education,College,Gajuwaka,"Modern Private ITI, New Gajuwaka","13-4-9, Gajuwaka","13-4-9, Gajuwaka, Visakhapatnam, Andhra Pradesh 530026",090106 25035,,,,Andhra Pradesh,India,,,,4.3,,,,,530026,,,,,
Education,College,Gajuwaka,Visakha Defence Academy Ycdi,"behind Vaibhav Jewellers, Kailash Nagar","behind Vaibhav Jewellers, Kailash Nagar, Gajuwaka, Visakhapatnam, Andhra Pradesh 530026",098485 77745,,visakhadefenceacademy.com,,Andhra Pradesh,India,,,,4,,,,,530026,,,,,
Education,College,Gajuwaka,Chaitanya Junior College Girls Campus,"26-51-4/1, Chaitanya Nagar","26-51-4/1, Chaitanya Nagar, Gajuwaka, Visakhapatnam, Andhra Pradesh 530044",089125 11103,,,,Andhra Pradesh,India,,,,3.3,,,,,530044,,,,,
Education,College,Gajuwaka,Tsr & Tbk Degree & Pg College,"5, Gajuwaka - Scindia Rd","5, Gajuwaka - Scindia Rd, Old Gajuwaka, Gajuwaka, Visakhapatnam, Andhra Pradesh 530026",089125 15657,,tsrtbkcollege.com,,Andhra Pradesh,India,,,,3.4,,,,,530026,,,,,
Education,College,Gajuwaka,News Degree College avk degree college oppiste cmr central gajwaka,"M5JW+9R9, Chaitanya Nagar","M5JW+9R9, Chaitanya Nagar, Gajuwaka, Visakhapatnam, Andhra Pradesh 530044",,,,,Andhra Pradesh,India,,,,4.4,,,,,530044,,,,,
Education,College,Gajuwaka,Sri Krishna Residential College,"M5JQ+XXR, Mango Grove","M5JQ+XXR, Mango Grove, Srinagar, Gajuwaka, Visakhapatnam, Andhra Pradesh 530026",089125 15657,,tsrtbkcollege.com,,Andhra Pradesh,India,,,,2.8,,,,,530026,,,,,
Education,College,Gajuwaka,ALWAR POLYTECHNIC,"Himachal Nagar, Mulagada","Himachal Nagar, Mulagada, Gajuwaka, Visakhapatnam, Andhra Pradesh 530026",099665 70395,,,,Andhra Pradesh,India,,,,4.8,,,,,530026,,,,,
Education,College,Gajuwaka,VIMS,"Himachal Nagar, Mulagada","Himachal Nagar, Mulagada, Gajuwaka, Visakhapatnam, Andhra Pradesh 530026",099665 70395,,,,Andhra Pradesh,India,,,,4.8,,,,,530026,,,,,
Education,College,Gajuwaka,Kakatiya (P) Industrial Training Institute (ITI),"BC Rd, Gajuwaka","BC Rd, Gajuwaka, Visakhapatnam, Andhra Pradesh 530026",095420 60060,,kakatiyaitivizag.com,,Andhra Pradesh,India,,,,3.7,,,,,530026,,,,,
Education,College,Gajuwaka,Sri Gowri Degree College,"BC Rd, Gajuwaka","BC Rd, Gajuwaka, Visakhapatnam, Andhra Pradesh 530026",095420 60060,,kakatiyaitivizag.com,,Andhra Pradesh,India,,,,3.7,,,,,530026,,,,,
Education,College,Gajuwaka,"Aakash Institute, Gajuwaka (Visakhapatnam)","Ground Floor, Celest Mall","Ground Floor, Celest Mall, Old Gajuwaka, Chaitanya Nagar, Gajuwaka, Visakhapatnam, Andhra Pradesh 530026",088000 13012,,centers.aakash.ac.in,,Andhra Pradesh,India,,,,3.8,,,,,530026,,,,,
Education,College,Gajuwaka,Datapro Computers - Software Training Institute - Gajuwaka Branch,"Ground Floor, Celest Mall","Ground Floor, Celest Mall, Old Gajuwaka, Chaitanya Nagar, Gajuwaka, Visakhapatnam, Andhra Pradesh 530026",088000 13012,,centers.aakash.ac.in,,Andhra Pradesh,India,,,,3.8,,,,,530026,,,,,
Education,College,Gajuwaka,"Govt. Polytechnic, Visakhapatnam","Via KD Peta Road, Ayyannapalem","Via KD Peta Road, Ayyannapalem, Andhra Pradesh 531116",089125 58251,,,,Andhra Pradesh,India,,,,3.7,,,,,531116,,,,,
Education,College,Gajuwaka,Alwardas Polytechnic College,"Via KD Peta Road, Ayyannapalem","Via KD Peta Road, Ayyannapalem, Andhra Pradesh 531116",089125 58251,,,,Andhra Pradesh,India,,,,3.7,,,,,531116,,,,,
Education,College,Gajuwaka,"Government ITI STEEL CITY, GAJUWAKA","Pedagantyada, Visakhapatnam","Pedagantyada, Visakhapatnam, Andhra Pradesh 530044",089125 13387,,,,Andhra Pradesh,India,,,,4.2,,,,,530044,,,,,
Education,College,Gajuwaka,Narayana IIT Spark Academy,"Pedagantyada, Visakhapatnam","Pedagantyada, Visakhapatnam, Andhra Pradesh 530044",089125 13387,,,,Andhra Pradesh,India,,,,4.2,,,,,530044,,,,,
Education,College,Gajuwaka,Chaitanya Degree College For Women,"10-1-78(1 NH 16, 26-44-6","10-1-78(1 NH 16, 26-44-6, Old, behind Palla Petrol Pump, Chaitanya Nagar, Gajuwaka, Visakhapatnam, Andhra Pradesh 530026",089127 47250,,chaitanyawomenscollege.org,,Andhra Pradesh,India,,,,3.8,,,,,530026,,,,,
Education,College,Gajuwaka,Sreepaada Degree College,"10-1-78(1 NH 16, 26-44-6","10-1-78(1 NH 16, 26-44-6, Old, behind Palla Petrol Pump, Chaitanya Nagar, Gajuwaka, Visakhapatnam, Andhra Pradesh 530026",089127 47250,,chaitanyawomenscollege.org,,Andhra Pradesh,India,,,,3.8,,,,,530026,,,,,
Education,College,Gajuwaka,C.P.E Junior College,"10-5-7, Sri Sai Surya Building","10-5-7, Sri Sai Surya Building, Ram Nagar, Visakhapatnam, Andhra Pradesh 530002",096668 29555,,cpecollege.edu.in,,Andhra Pradesh,India,,,,4.7,,,,,530002,,,,,
Education,College,Gajuwaka,Sri chaitanya junior college,"24-37-1, Vuda Colony","24-37-1, Vuda Colony, Gonthinavanipalem, Pedagantyada, Visakhapatnam, Andhra Pradesh 530026",040 6615 1515,,srichaitanya.net,,Andhra Pradesh,India,,,,3.2,,,,,530026,,,,,
Education,College,Gajuwaka,UNITY DEGREE COLLEGE,"UNITY DEGREE COLLEGE, Bowdara Rd","UNITY DEGREE COLLEGE, Bowdara Rd, Visakhapatnam",077994 47175,,unitydegreecollege.com,,Andhra Pradesh,India,,,,4.4,,,,,530003,,,,,
Education,College,Gajuwaka,Techno World Pvt Iti China Gantada Gajuwaka,"M5MW+CFX, China Gantyada","M5MW+CFX, China Gantyada, Gonthinavanipalem, Gajuwaka, Visakhapatnam, Andhra Pradesh 530026",,,,,Andhra Pradesh,India,,,,4.3,,,,,530026,,,,,
Education,College,Gajuwaka,AP Theological University,"23-23-7, BC Rd","23-23-7, BC Rd, Azeemabad, Gajuwaka, Visakhapatnam, Andhra Pradesh 530026",096664 44222,,,,Andhra Pradesh,India,,,,3.9,,,,,530026,,,,,
Education,College,Gajuwaka,"Manasa Defence Academy | Best defence academy in India| NDA, Navy, Army, Airforce in Vizag","68-1-83, New","68-1-83, New, Gajuwaka Bus Depot Rd, behind INS eksila, Mulagada, Gajuwaka, Visakhapatnam, Andhra Pradesh 530012",077997 99221,,manasadefenceacademy.com,,Andhra Pradesh,India,,,,4.2,,,,,530012,,,,,
Education,College,Gajuwaka,Gajuwaka,"24-82-3, Kanithi Rd","24-82-3, Kanithi Rd, Gonthinavanipalem, Gajuwaka, Visakhapatnam, Andhra Pradesh 530011",,,,,Andhra Pradesh,India,,,,5,,,,,530011,,,,,
Education,College,Gajuwaka,KOTHAVALASA(SETTY),"M6P9+P9H, Maharani Peta","M6P9+P9H, Maharani Peta, Gajuwaka, Visakhapatnam, Andhra Pradesh 530011",,,,,Andhra Pradesh,India,,,,,,,,,530011,,,,,
Education,College,Gajuwaka,Bhishma Institute of Management and Science,"51-17-2/6, Kranthinagar","51-17-2/6, Kranthinagar, opp. Jayabheri Showroom, Maddilapalem, Visakhapatnam, Andhra Pradesh 530016",063035 34789,,bhishmaeducations.com,,Andhra Pradesh,India,,,,4.8,,,,,530016,,,,,
Education,College,Gajuwaka,Sri Chaitanya Excel Campus,"M5MV+GWJ, Chaitanya Nagar","M5MV+GWJ, Chaitanya Nagar, Gajuwaka, Visakhapatnam, Andhra Pradesh 530026",,,,,Andhra Pradesh,India,,,,3.6,,,,,530026,,,,,
Education,College,Gajuwaka,Vinex Degree College,"47-11-20 3, Dwaraka Nagar 1st Ln","47-11-20 3, Dwaraka Nagar 1st Ln, opp. Sarovar Hotel, Opposite Hotel Sarovar, Railway New Colony, Visakhapatnam, Andhra Pradesh 530016",094941 53431,,vinexdegree.edu.in,,Andhra Pradesh,India,,,,4.6,,,,,530016,,,,,
Education,College,Gajuwaka,SVS Technology And Solutions,"47-11-20 3, Dwaraka Nagar 1st Ln","47-11-20 3, Dwaraka Nagar 1st Ln, opp. Sarovar Hotel, Opposite Hotel Sarovar, Railway New Colony, Visakhapatnam, Andhra Pradesh 530016",094941 53431,,vinexdegree.edu.in,,Andhra Pradesh,India,,,,4.6,,,,,530016,,,,,
Education,College,Gajuwaka,Government Junior College,"M4PV+PV4, Prasanthinagar","M4PV+PV4, Prasanthinagar, Aganampudi, Visakhapatnam, Andhra Pradesh 530053",,,,,Andhra Pradesh,India,,,,3.6,,,,,530053,,,,,
Education,College,Gajuwaka,ResoVIZAG - Educational Institution,"M4PV+PV4, Prasanthinagar","M4PV+PV4, Prasanthinagar, Aganampudi, Visakhapatnam, Andhra Pradesh 530053",,,,,Andhra Pradesh,India,,,,3.6,,,,,530053,,,,,
Education,College,Gajuwaka,Nagesh,"M6P9+P9H, Maharani Peta","M6P9+P9H, Maharani Peta, Gajuwaka, Visakhapatnam, Andhra Pradesh 530011",,,,,Andhra Pradesh,India,,,,,,,,,530011,,,,,
Education,College,Gajuwaka,Sudhiksha iit & medical academy,"M5Q8+RG2, Road No. 1","M5Q8+RG2, Road No. 1, Sathavahana Nagar, Kurmannapalem, Visakhapatnam, Andhra Pradesh 530046",083747 69988,,sudhikshaiitandmedicalacademy.com,,Andhra Pradesh,India,,,,4.8,,,,,530046,,,,,
Education,College,Gajuwaka,Kites Junior College,"50-93-23, Sai Baba Temple St","50-93-23, Sai Baba Temple St, near Gurudwara Junction, Santhipuram, Dwaraka Nagar, Visakhapatnam, Andhra Pradesh 530016",081254 42244,,kitesca.com,,Andhra Pradesh,India,,,,4.5,,,,,530016,,,,,
